{
  "schemaVersion": "1.0.0",
  "id": "reordered-rgbwaluv-13ch",
  "name": "Reordered fixture example",
  "footprint": 13,
  "channels": [
    {"slot": 1, "attribute": "red", "mode": "continuous", "dmxMin": 0, "dmxMax": 255, "home": 0},
    {"slot": 2, "attribute": "blue", "mode": "continuous", "dmxMin": 0, "dmxMax": 255, "home": 0},
    {"slot": 3, "attribute": "green", "mode": "continuous", "dmxMin": 0, "dmxMax": 255, "home": 0},
    {"slot": 4, "attribute": "dimmer", "mode": "continuous", "dmxMin": 0, "dmxMax": 255, "home": 0},
    {"slot": 5, "attribute": "white", "mode": "continuous", "dmxMin": 0, "dmxMax": 255, "home": 0},
    {"slot": 6, "attribute": "amber", "mode": "continuous", "dmxMin": 0, "dmxMax": 255, "home": 0},
    {"slot": 7, "attribute": "uv", "mode": "continuous", "dmxMin": 0, "dmxMax": 255, "home": 0},
    {"slot": 8, "attribute": "lime", "mode": "continuous", "dmxMin": 0, "dmxMax": 255, "home": 0},
    {"slot": 9, "attribute": "strobe", "mode": "range", "dmxMin": 16, "dmxMax": 239, "home": 0},
    {"slot": 10, "attribute": "zoom", "mode": "continuous", "dmxMin": 0, "dmxMax": 255, "home": 128},
    {"slot": 11, "attribute": "macro", "mode": "range", "dmxMin": 0, "dmxMax": 255, "home": 0},
    {"slot": 12, "attribute": "speed", "mode": "continuous", "dmxMin": 0, "dmxMax": 255, "home": 0},
    {"slot": 13, "attribute": "reset", "mode": "trigger", "dmxMin": 240, "dmxMax": 255, "home": 0, "dangerous": true}
  ]
}
